year,authors,is_my_paper,title,journal,volume,issue,page,doi,abstract,type,has_doi
2021,"Steven Riley, Oliver Eales, David Haw, et al.",YES,REACT-1 round 13 interim report: acceleration of SARS-CoV-2 Delta epidemic in the community in England during late June and early July 2021,[],,,,10.1101/2021.07.08.21260185,"<jats:title>Abstract</jats:title> <jats:sec> <jats:title>Background</jats:title> Despite high levels of vaccination in the adult population, cases of COVID-19 have risen exponentially in England since the start of May 2021 driven by the Delta variant. However, with far fewer hospitalisations and deaths per case during the recent growth in cases compared with 2020, it is intended that all remaining social distancing legislation in England will be removed from 19 July 2021. </jats:sec> <jats:sec> <jats:title>Methods</jats:title> We report interim results from round 13 of the REal-time Assessment of Community Transmission-1 (REACT-1) study in which a cross-sectional sample of the population of England was asked to provide a throat and nose swab for RT-PCR and to answer a questionnaire. Data collection for this report (round 13 interim) was from 24 June to 5 July 2021. </jats:sec> <jats:sec> <jats:title>Results</jats:title> In round 13 interim, we found 237 positives from 47,729 swabs giving a weighted prevalence of 0.59% (0.51%, 0.68%) which was approximately four-fold higher compared with round 12 at 0.15% (0.12%, 0.18%). This resulted from continued exponential growth in prevalence with an average doubling time of 15 (13, 17) days between round 12 and round 13. However, during the recent period of round 13 interim only, we observed a shorter doubling time of 6.1 (4.0, 12) days with a corresponding R number of 1.87 (1.40, 2.45). There were substantial increases in all age groups under the age of 75 years, and especially at younger ages, with the highest prevalence in 13 to 17 year olds at 1.33% (0.97%, 1.82%) and in 18 to 24 years olds at 1.40% (0.89%, 2.18%). Infections have increased in all regions with the largest increase in London where prevalence increased more than eight-fold from 0.13% (0.08%, 0.20%) in round 12 to 1.08% (0.79%, 1.47%) in round 13 interim. Overall, prevalence was over 3 times higher in the unvaccinated compared with those reporting two doses of vaccine in both round 12 and round 13 interim, although there was a similar proportional increase in prevalence in vaccinated and unvaccinated individuals between the two rounds. </jats:sec> <jats:sec> <jats:title>Discussion</jats:title> We are entering a critical period with a number of important competing processes: continued vaccination rollout to the whole adult population in England, increased natural immunity through infection, reduced social mixing of children during school holidays, increased proportion of mixing occurring outdoors during summer, the intended full opening of hospitality and entertainment and cessation of mandated social distancing and mask wearing. Surveillance programmes are essential during this next phase of the epidemic to provide clear evidence to the government and the public on the levels and trends in prevalence of infections and their relationship to vaccine coverage, hospitalisations, deaths and Long COVID. </jats:sec>",posted-content,YES
2021,"Steven Riley, Haowei Wang, Oliver Eales, et al.",YES,REACT-1 round 12 report: resurgence of SARS-CoV-2 infections in England associated with increased frequency of the Delta variant,[],,,,10.1101/2021.06.17.21259103,"<jats:title>Abstract</jats:title> <jats:sec> <jats:title>Background</jats:title> England entered a third national lockdown from 6 January 2021 due to the COVID-19 pandemic. Despite a successful vaccine rollout during the first half of 2021, cases and hospitalisations have started to increase since the end of May as the SARS-CoV-2 Delta (B.1.617.2) variant increases in frequency. The final step of relaxation of COVID-19 restrictions in England has been delayed from 21 June to 19 July 2021. </jats:sec> <jats:sec> <jats:title>Methods</jats:title> The REal-time Assessment of Community Transmision-1 (REACT-1) study measures the prevalence of swab-positivity among random samples of the population of England. Round 12 of REACT-1 obtained self-administered swab collections from participants from 20 May 2021 to 7 June 2021; results are compared with those for round 11, in which swabs were collected from 15 April to 3 May 2021. </jats:sec> <jats:sec> <jats:title>Results</jats:title> Between rounds 11 and 12, national prevalence increased from 0.10% (0.08%, 0.13%) to 0.15% (0.12%, 0.18%). During round 12, we detected exponential growth with a doubling time of 11 (7.1, 23) days and an R number of 1.44 (1.20, 1.73). The highest prevalence was found in the North West at 0.26% (0.16%, 0.41%) compared to 0.05% (0.02%, 0.12%) in the South West. In the North West, the locations of positive samples suggested a cluster in Greater Manchester and the east Lancashire area. Prevalence in those aged 5-49 was 2.5 times higher at 0.20% (0.16%, 0.26%) compared with those aged 50 years and above at 0.08% (0.06%, 0.11%). At the beginning of February 2021, the link between infection rates and hospitalisations and deaths started to weaken, although in late April 2021, infection rates and hospital admissions started to reconverge. When split by age, the weakened link between infection rates and hospitalisations at ages 65 years and above was maintained, while the trends converged below the age of 65 years. The majority of the infections in the younger group occurred in the unvaccinated population or those without a stated vaccine history. We observed the rapid replacement of the Alpha (B.1.1.7) variant of SARS-CoV-2 with the Delta variant during the period covered by rounds 11 and 12 of the study. </jats:sec> <jats:sec> <jats:title>Discussion</jats:title> The extent to which exponential growth continues, or slows down as a consequence of the continued rapid roll-out of the vaccination programme, including to young adults, requires close monitoring. Data on community prevalence are vital to track the course of the epidemic and inform ongoing decisions about the timing of further lifting of restrictions in England. </jats:sec>",posted-content,YES
2021,"Steven Riley, Kylie E. C. Ainslie, Oliver Eales, et al.",YES,Resurgence of SARS-CoV-2: Detection by community viral surveillance,Science,372,6545,990-995,10.1126/science.abf0874,"<jats:title>Community virus surveillance</jats:title> Even highly effective vaccines will not save us from the need to monitor severe acute respiratory syndrome coronavirus 2 (SARS-CoV-2) activity, perhaps for years to come. Public health institutions will need early warning of any uptick in cases to prepare and deploy interventions as required. Riley et al. developed a community-wide program that was designed to detect resurgence at low prevalence and has been used to track SARS-CoV-2 virus across England. In the four rounds of sampling from May to September 2020, almost 600,000 people representative of all communities were monitored. The results revealed the greatest prevalence among 18- to 24-year-olds, with increasing incidence among older age groups and elevated odds of infection among some communities. This testing approach offers a model for the type of real-time, country-wide population-based surveillance work that needs to be conducted to monitor SARS-CoV-2. Science , abf0874, this issue p. <jats:related-article issue=""6545"" page=""990"" related-article-type=""in-this-issue"" vol=""372"">990</jats:related-article>",journal-article,YES
2021,"Steven Riley, David Haw, Caroline E. Walters, et al.",YES,REACT-1 round 11 report: low prevalence of SARS-CoV-2 infection in the community prior to the third step of the English roadmap out of lockdown,[],,,,10.1101/2021.05.13.21257144,"<jats:title>Abstract</jats:title> <jats:sec> <jats:title>Background</jats:title> National epidemic dynamics of SARS-CoV-2 infections are being driven by: the degree of recent indoor mixing (both social and workplace), vaccine coverage, intrinsic properties of the circulating lineages, and prior history of infection (via natural immunity). In England, infections, hospitalisations and deaths fell during the first two steps of the “roadmap” for exiting the third national lockdown. The third step of the roadmap in England takes place on 17 May 2021. </jats:sec> <jats:sec> <jats:title>Methods</jats:title> We report the most recent findings on community infections from the REal-time Assessment of Community Transmission-1 (REACT-1) study in which a swab is obtained from a representative cross-sectional sample of the population in England and tested using PCR. Round 11 of REACT-1 commenced self-administered swab-collection on 15 April 2021 and completed collections on 3 May 2021. We compare the results of REACT-1 round 11 to round 10, in which swabs were collected from 11 to 30 March 2021. </jats:sec> <jats:sec> <jats:title>Results</jats:title> Between rounds 10 and 11, prevalence of swab-positivity dropped by 50% in England from 0.20% (0.17%, 0.23%) to 0.10% (0.08%, 0.13%), with a corresponding R estimate of 0.90 (0.87, 0.94). Rates of swab-positivity fell in the 55 to 64 year old group from 0.17% (0.12%, 0.25%) in round 10 to 0.06% (0.04%, 0.11%) in round 11. Prevalence in round 11 was higher in the 25 to 34 year old group at 0.21% (0.12%, 0.38%) than in the 55 to 64 year olds and also higher in participants of Asian ethnicity at 0.31% (0.16%, 0.60%) compared with white participants at 0.09% (0.07%, 0.11%). Based on sequence data for positive samples for which a lineage could be identified, we estimate that 92.3% (75.9%, 97.9%, n=24) of infections were from the B.1.1.7 lineage compared to 7.7% (2.1%, 24.1%, n=2) from the B.1.617.2 lineage. Both samples from the B.1.617.2 lineage were detected in London from participants not reporting travel in the previous two weeks. Also, allowing for suitable lag periods, the prior close alignment between prevalence of infections and hospitalisations and deaths nationally has diverged. </jats:sec> <jats:sec> <jats:title>Discussion</jats:title> We observed marked reductions in prevalence from March to April and early May 2021 in England reflecting the success of the vaccination programme and despite easing of restrictions during lockdown. However, there is potential upwards pressure on prevalence from the further easing of lockdown regulations and presence of the B.1.617.2 lineage. If prevalence rises in the coming weeks, policy-makers will need to assess the possible impact on hospitalisations and deaths. In addition, consideration should be given to other health and economic impacts if increased levels of community transmission occur. </jats:sec>",posted-content,YES
2021,"Helen Ward, Graham S. Cooke, Christina Atchison, et al.",YES,"Prevalence of antibody positivity to SARS-CoV-2 following the first peak of infection in England: Serial cross-sectional studies of 365,000 adults",The Lancet Regional Health - Europe,4,,100098,10.1016/j.lanepe.2021.100098,,journal-article,YES
2021,"Steven Riley, Oliver Eales, David Haw, et al.",YES,REACT-1 round 10 report: Level prevalence of SARS-CoV-2 swab-positivity in England during third national lockdown in March 2021,[],,,,10.1101/2021.04.08.21255100,"<jats:title>Abstract</jats:title> <jats:sec> <jats:title>Background</jats:title> In England, hospitalisations and deaths due to SARS-CoV-2 have been falling consistently since January 2021 during the third national lockdown of the COVID-19 pandemic. The first significant relaxation of that lockdown occurred on 8 March when schools reopened. </jats:sec> <jats:sec> <jats:title>Methods</jats:title> The REal-time Assessment of Community Transmission-1 (REACT-1) study augments routine surveillance data for England by measuring swab-positivity for SARS-CoV-2 in the community. The current round, round 10, collected swabs from 11 to 30 March 2021 and is compared here to round 9, in which swabs were collected from 4 to 23 February 2021. </jats:sec> <jats:sec> <jats:title>Results</jats:title> During round 10, we estimated an R number of 1.00 (95% confidence interval 0.81, 1.21). Between rounds 9 and 10 we estimated national prevalence has dropped by ∼60% from 0.49% (0.44%, 0.55%) in February to 0.20% (0.17%, 0.23%) in March. There were substantial falls in weighted regional prevalence: in South East from 0.36% (0.29%, 0.44%) in round 9 to 0.07% (0.04%, 0.12%) in round 10; London from 0.60% (0.48%, 0.76%) to 0.16% (0.10%, 0.26%); East of England from 0.47% (0.36%, 0.60%) to 0.15% (0.10%, 0.24%); East Midlands from 0.59% (0.45%, 0.77%) to 0.19% (0.13%, 0.28%); and North West from 0.69% (0.54%, 0.88%) to 0.31% (0.21%, 0.45%). Areas of apparent higher prevalence remain in parts of the North West, and Yorkshire and The Humber. The highest prevalence in March was found among school-aged children 5 to 12 years at 0.41% (0.27%, 0.62%), compared with the lowest in those aged 65 to 74 and 75 and over at 0.09% (0.05%, 0.16%). The close approximation between prevalence of infections and deaths (suitably lagged) is diverging, suggesting that infections may have resulted in fewer hospitalisations and deaths since the start of widespread vaccination. </jats:sec> <jats:sec> <jats:title>Conclusion</jats:title> We report a sharp decline in prevalence of infections between February and March 2021. We did not observe an increase in the prevalence of SARS-CoV-2 following the reopening of schools in England, although the decline of prevalence appears to have stopped. Future rounds of REACT-1 will be able to measure the rate of growth or decline from this current plateau and hence help assess the effectiveness of the vaccination roll-out on transmission of the virus as well as the potential size of any third wave during the ensuing months. </jats:sec>",posted-content,YES
2021,"Steven Riley, Haowei Wang, Oliver Eales, et al.",YES,REACT-1 round 9 final report: Continued but slowing decline of prevalence of SARS-CoV-2 during national lockdown in England in February 2021,[],,,,10.1101/2021.03.03.21252856,"<jats:title>Abstract</jats:title> <jats:sec> <jats:title>Background</jats:title> England will start to exit its third national lockdown in response to the COVID-19 pandemic on 8th March 2021, with safe effective vaccines being rolled out rapidly against a background of emerging transmissible and immunologically novel variants of SARS-CoV-2. A subsequent increase in community prevalence of infection could delay further relaxation of lockdown if vaccine uptake and efficacy are not sufficiently high to prevent increased pressure on healthcare services. </jats:sec> <jats:sec> <jats:title>Methods</jats:title> The PCR self-swab arm of the REal-time Assessment of Community Transmission Study (REACT-1) estimates community prevalence of SARS-CoV-2 infection in England based on random cross-sections of the population ages five and over. Here, we present results from the complete round 9 of REACT-1 comprising round 9a in which swabs were collected from 4th to 12th February 2021 and round 9b from 13th to 23rd February 2021. We also compare the results of REACT-1 round 9 to round 8, in which swabs were collected mainly from 6th January to 22nd January 2021. </jats:sec> <jats:sec> <jats:title>Results</jats:title> Out of 165,456 results for round 9 overall, 689 were positive. Overall weighted prevalence of infection in the community in England was 0.49% (0.44%, 0.55%), representing a fall of over two thirds from round 8. However the rate of decline of the epidemic has slowed from 15 (13, 17) days, estimated for the period from the end of round 8 to the start of round 9, to 31 days estimated using data from round 9 alone (lower confidence limit 17 days). When comparing round 9a to 9b there were apparent falls in four regions, no apparent change in one region and apparent rises in four regions, including London where there was a suggestion of sub-regional heterogeneity in growth and decline. Smoothed prevalence maps suggest large contiguous areas of growth and decline that do not align with administrative regions. Prevalence fell by 50% or more across all age groups in round 9 compared to round 8, with prevalence (round 9) ranging from 0.21% in those aged 65 and over to 0.71% in those aged 13 to 17 years. Round 9 prevalence was highest among Pakistani participants at 2.1% compared to white participants at 0.45% and Black participants at 0.83%. There were higher adjusted odds of infection for healthcare and care home workers, for those working in public transport and those working in education, school, nursery or childcare and lower adjusted odds for those not required to work outside the home. </jats:sec> <jats:sec> <jats:title>Conclusions</jats:title> Community prevalence of swab-positivity has declined markedly between January and February 2021 during lockdown in England, but remains high; the rate of decline has slowed in the most recent period, with a suggestion of pockets of growth. Continued adherence to social distancing and public health measures is required so that infection rates fall to much lower levels. This will help to ensure that the benefits of the vaccination roll-out programme in England are fully realised. </jats:sec>",posted-content,YES
2021,"Steven Riley, Caroline E. Walters, Haowei Wang, et al.",YES,REACT-1 round 9 interim report: downward trend of SARS-CoV-2 in England in February 2021 but still at high prevalence,[],,,,10.1101/2021.02.18.21251973,"<jats:title>Abstract</jats:title> <jats:sec> <jats:title>Background and Methods</jats:title> England entered its third national lockdown of the COVID-19 pandemic on 6th January 2021 with the aim of reducing the daily number of deaths and pressure on healthcare services. The real-time assessment of community transmission study (REACT-1) obtains throat and nose swabs from randomly selected people in England in order to describe patterns of SARS-CoV-2 prevalence. Here, we report data from round 9a of REACT-1 for swabs collected between 4th and 13th February 2021. </jats:sec> <jats:sec> <jats:title>Results</jats:title> Out of 85,473 tested-swabs, 378 were positive. Overall weighted prevalence of infection in the community in England was 0.51%, a fall of more than two thirds since our last report (round 8) in January 2021 when 1.57% of people tested positive. We estimate a halving time of 14.6 days and a reproduction number R of 0.72, based on the difference in prevalence between the end of round 8 and the beginning of round 9. Although prevalence fell in all nine regions of England over the same period, there was greater uncertainty in the trend for North West, North East, and Yorkshire and The Humber. Prevalence fell substantially across all age groups with highest prevalence among 18- to 24-year olds at 0.89% (0.47%, 1.67%) and those aged 5 to12 years at 0.86% (0.60%, 1.24%). Large household size, living in a deprived neighbourhood, and Asian ethnicity were all associated with increased prevalence. Healthcare and care home workers were more likely to test positive compared to other workers. </jats:sec> <jats:sec> <jats:title>Conclusions</jats:title> There is a strong decline in prevalence of SARS-CoV-2 in England among the general population five to six weeks into lockdown, but prevalence remains high: at levels similar to those observed in late September 2020. Also, the number of COVID-19 cases in hospitals is higher than at the peak of the first wave in April 2020. The effects of easing of social distancing when we transition out of lockdown need to be closely monitored to avoid a resurgence in infections and renewed pressure on health services. </jats:sec>",posted-content,YES
2021,"Pierre Nouvellet, Sangeeta Bhatia, Anne Cori, et al.",YES,Reduction in mobility and COVID-19 transmission,Nature Communications,12,1,,10.1038/s41467-021-21358-2,"<jats:title>Abstract</jats:title>In response to the COVID-19 pandemic, countries have sought to control SARS-CoV-2 transmission by restricting population movement through social distancing interventions, thus reducing the number of contacts. Mobility data represent an important proxy measure of social distancing, and here, we characterise the relationship between transmission and mobility for 52 countries around the world. Transmission significantly decreased with the initial reduction in mobility in 73% of the countries analysed, but we found evidence of decoupling of transmission and mobility following the relaxation of strict control measures for 80% of countries. For the majority of countries, mobility explained a substantial proportion of the variation in transmissibility (median adjusted R-squared: 48%, interquartile range - IQR - across countries [27–77%]). Where a change in the relationship occurred, predictive ability decreased after the relaxation; from a median adjusted R-squared of 74% (IQR across countries [49–91%]) pre-relaxation, to a median adjusted R-squared of 30% (IQR across countries [12–48%]) post-relaxation. In countries with a clear relationship between mobility and transmission both before and after strict control measures were relaxed, mobility was associated with lower transmission rates after control measures were relaxed indicating that the beneficial effects of ongoing social distancing behaviours were substantial.",journal-article,YES
2021,"Helen Ward, Christina Atchison, Matthew Whitaker, et al.",YES,SARS-CoV-2 antibody prevalence in England following the first peak of the pandemic,Nature Communications,12,1,,10.1038/s41467-021-21237-w,"<jats:title>Abstract</jats:title> England has experienced a large outbreak of SARS-CoV-2, disproportionately affecting people from disadvantaged and ethnic minority communities. It is unclear how much of this excess is due to differences in exposure associated with structural inequalities. Here, we report from the REal-time Assessment of Community Transmission-2 (REACT-2) national study of over 100,000 people. After adjusting for test characteristics and re-weighting to the population, overall antibody prevalence is 6.0% (95% CI: 5.8-6.1). An estimated 3.4 million people had developed antibodies to SARS-CoV-2 by mid-July 2020. Prevalence is two- to three-fold higher among health and care workers compared with non-essential workers, and in people of Black or South Asian than white ethnicity, while age- and sex-specific infection fatality ratios are similar across ethnicities. Our results indicate that higher hospitalisation and mortality from COVID-19 in minority ethnic groups may reflect higher rates of infection rather than differential experience of disease or care.",journal-article,YES
2021,"Steven Riley, Oliver Eales, Caroline E. Walters, et al.",YES,REACT-1 round 8 final report: high average prevalence with regional heterogeneity of trends in SARS-CoV-2 infection in the community in England during January 2021,[],,,,10.1101/2021.01.28.21250606,"<jats:title>Abstract</jats:title> In early January 2021, England entered its third national lockdown of the COVID-19 pandemic to reduce numbers of deaths and pressure on healthcare services, while rapidly rolling out vaccination to healthcare workers and those most at risk of severe disease and death. REACT-1 is a survey of SARS-CoV-2 prevalence in the community in England, based on repeated cross-sectional samples of the population. Between 6th and 22nd January 2021, out of 167,642 results, 2,282 were positive giving a weighted national prevalence of infection of 1.57% (95% CI, 1.49%, 1.66%). The R number nationally over this period was estimated at 0.98 (0.92, 1.04). Prevalence remained high throughout, but with suggestion of a decline at the end of the study period. The average national trend masked regional heterogeneity, with robustly decreasing prevalence in one region (South West) and increasing prevalence in another (East Midlands). Overall prevalence at regional level was highest in London at 2.83% (2.53%, 3.16%). Although prevalence nationally was highest in the low-risk 18 to 24 year old group at 2.44% (1.96%, 3.03%), it was also high in those over 65 years who are most at risk, at 0.93% (0.82%, 1.05%). Large household size, living in a deprived neighbourhood, and Black and Asian ethnicity were all associated with higher levels of infections compared to smaller households, less deprived neighbourhoods and other ethnicities. Healthcare and care home workers, and other key workers, were more likely to test positive compared to other workers. If sustained lower prevalence is not achieved rapidly in England, pressure on healthcare services and numbers of COVID-19 deaths will remain unacceptably high.",posted-content,YES
